{"$id":"urn:randle:r5:observation_authority","$schema":"https://json-schema.org/draft/2020-12/schema","additionalProperties":false,"properties":{"authority_id":{"const":"R5-OBSERVATION-AUTHORITY"},"expectation_dependency":{"const":"NONE"},"producer_authority":{"const":"R5-EVENT-SOURCE-ISSUER"},"provenance_root":{"const":"76f9db577ca4e88b4bdde0ca30907dd96173ab6386c0626ecd5471de3502d04c"},"schema_version":{"const":"7.0.0-DRAFT"},"source_kind":{"const":"CURRENT_RUN_ENFORCEMENT_EVENTS"},"valid_from":{"const":"2026-07-22T20:00:00Z"}},"required":["schema_version","authority_id","source_kind","provenance_root","expectation_dependency","producer_authority","valid_from"],"type":"object"}
