{"authority_id":"R5-OBSERVATION-AUTHORITY","expectation_dependency":"NONE","producer_authority":"R5-EVENT-SOURCE-ISSUER","provenance_root":"76f9db577ca4e88b4bdde0ca30907dd96173ab6386c0626ecd5471de3502d04c","schema_version":"7.0.0-DRAFT","source_kind":"CURRENT_RUN_ENFORCEMENT_EVENTS","valid_from":"2026-07-22T20:00:00Z"}
